{
  "schemaVersion": 3,
  "id": "apple-inc",
  "name": "Apple, Inc.",
  "aliases": [],
  "parentCompanyId": null,
  "identifiers": {
    "wikidata": "Q312",
    "lei": "HWUPKR0MPOU8FGXBT394"
  },
  "hq": {
    "country": "US",
    "city": "Cupertino",
    "lat": 37.3175,
    "lon": -122.041944444,
    "sources": [
      {
        "url": "https://www.wikidata.org/wiki/Q312",
        "label": "Wikidata",
        "retrievedAt": "2026-06-12"
      }
    ]
  },
  "manufacturing": [],
  "scores": {},
  "xmetas": [
    {
      "key": "fact.carbon-neutral-2030",
      "type": "fact",
      "value": "Apple states a plan to become carbon neutral across its business, manufacturing supply chain, and product life cycle by 2030.",
      "url": "https://www.apple.com/newsroom/2020/07/apple-commits-to-be-100-percent-carbon-neutral-for-its-supply-chain-and-products-by-2030/",
      "retrievedAt": "2026-06-12",
      "validUntil": "2030-12-31",
      "lang": "en"
    },
    {
      "key": "fact.emissions-reduction-2024",
      "type": "fact",
      "value": "Apple reported reducing its gross carbon footprint by more than 60% compared with fiscal year 2015 as of fiscal year 2024.",
      "url": "https://www.apple.com/environment/pdf/Apple_CDP-Corporate-Questionnaire_2025.pdf",
      "retrievedAt": "2026-06-12",
      "validUntil": null,
      "lang": "en"
    }
  ],
  "provenance": {
    "maintainedBy": "brands-maintenance",
    "batch": "001",
    "updatedAt": "2026-06-12"
  }
}
