{
  "schemaVersion": 3,
  "id": "acer-inc",
  "name": "Acer, Inc.",
  "aliases": [],
  "parentCompanyId": null,
  "identifiers": {
    "wikidata": "Q481778",
    "lei": "2549006Z3IVAZIQEUM25"
  },
  "hq": {
    "country": "TW",
    "city": "New Taipei",
    "lat": 25.0125,
    "lon": 121.465,
    "sources": [
      {
        "url": "https://www.wikidata.org/wiki/Q481778",
        "label": "Wikidata",
        "retrievedAt": "2026-06-12"
      }
    ]
  },
  "manufacturing": [],
  "scores": {
    "msci": {
      "value": 6,
      "rating": "AAA",
      "scale": {
        "min": 0,
        "max": 6,
        "higherIsBetter": true
      },
      "url": "https://news.acer.com/acer-publishes-2024-sustainability-report-achieves-60-renewable-electricity-usage-ahead-of-target",
      "retrievedAt": "2026-06-12"
    }
  },
  "xmetas": [
    {
      "key": "fact.renewable-electricity-2035",
      "type": "fact",
      "value": "Acer states a commitment to reach 100% renewable electricity for global operations by 2035.",
      "url": "https://www.acer.com/sustainability/en/nature-and-climate-transformation-home/nature-and-climate-actions",
      "retrievedAt": "2026-06-12",
      "validUntil": "2035-12-31",
      "lang": "en"
    },
    {
      "key": "certification.ecovadis-platinum-2024",
      "type": "certification",
      "value": "Acer reported receiving an EcoVadis Platinum medal for the third consecutive year, placing it among the top 1% of rated companies.",
      "url": "https://news.acer.com/acer-publishes-2024-sustainability-report-achieves-60-renewable-electricity-usage-ahead-of-target",
      "retrievedAt": "2026-06-12",
      "validUntil": null,
      "lang": "en"
    }
  ],
  "provenance": {
    "maintainedBy": "brands-maintenance",
    "batch": "001",
    "updatedAt": "2026-06-12"
  }
}
