{
  "schemaVersion": 3,
  "id": "asbisc-enterprises-plc",
  "name": "ASBISc Enterprises Plc",
  "aliases": [],
  "parentCompanyId": null,
  "identifiers": {
    "wikidata": "Q15213921"
  },
  "hq": {
    "country": "CY",
    "city": "Limassol",
    "lat": 34.674997,
    "lon": 33.044286,
    "sources": [
      {
        "url": "https://www.wikidata.org/wiki/Q15213921",
        "label": "Wikidata",
        "retrievedAt": "2026-06-12"
      }
    ]
  },
  "manufacturing": [],
  "scores": {},
  "xmetas": [
    {
      "key": "fact.sustainability-reporting-2024",
      "type": "fact",
      "value": "ASBIS publishes a 2024 sustainability report through its investor portal CSR reports section.",
      "url": "https://investor.asbis.com/csr-reports",
      "retrievedAt": "2026-06-12",
      "validUntil": null,
      "lang": "en"
    },
    {
      "key": "fact.business-profile",
      "type": "fact",
      "value": "ASBIS states it is a Cyprus-based distributor of IT components, blocks, and peripherals with 33 warehouses.",
      "url": "https://investor.asbis.com/business-strategy",
      "retrievedAt": "2026-06-12",
      "validUntil": null,
      "lang": "en"
    }
  ],
  "provenance": {
    "maintainedBy": "brands-maintenance",
    "batch": "001",
    "updatedAt": "2026-06-12"
  }
}
