{
  "schemaVersion": 3,
  "id": "arcelik-as",
  "name": "Arçelik AS",
  "aliases": [],
  "parentCompanyId": null,
  "identifiers": {
    "wikidata": "Q640497",
    "lei": "789000748KTQCUMJ0R25"
  },
  "hq": {
    "country": "TR",
    "city": "Istanbul",
    "lat": 41.01,
    "lon": 28.960277777,
    "sources": [
      {
        "url": "https://www.wikidata.org/wiki/Q640497",
        "label": "Wikidata",
        "retrievedAt": "2026-06-12"
      }
    ]
  },
  "manufacturing": [],
  "scores": {
    "spglobal": {
      "value": 86,
      "rating": "DHP Household Durables industry leader",
      "scale": {
        "min": 0,
        "max": 100,
        "higherIsBetter": true
      },
      "url": "https://www.arcelikglobal.com/en/sustainability/awards-achievements/",
      "retrievedAt": "2026-06-12"
    }
  },
  "xmetas": [
    {
      "key": "fact.global-100-2024",
      "type": "fact",
      "value": "Arçelik states it was listed in the 2024 Global 100 Index for the fourth consecutive year, ranking 60th globally and first in Household Durables.",
      "url": "https://www.arcelikglobal.com/en/sustainability/awards-achievements/",
      "retrievedAt": "2026-06-12",
      "validUntil": null,
      "lang": "en"
    },
    {
      "key": "fact.cdp-reporting",
      "type": "fact",
      "value": "Arçelik publishes CDP reports, including 2025 and 2024 CDP reports, on its corporate reports page.",
      "url": "https://www.arcelikglobal.com/en/company/reports-presentations/cdp-reports/",
      "retrievedAt": "2026-06-12",
      "validUntil": null,
      "lang": "en"
    }
  ],
  "provenance": {
    "maintainedBy": "brands-maintenance",
    "batch": "001",
    "updatedAt": "2026-06-12"
  }
}
